,Book Title,Author,Description,Genre
0,"Hush, Hush",Becca Fitzpatrick,"A SACRED OATHA FALLEN ANGELA FORBIDDEN LOVERomance was not part of Nora Grey's plan. She's never been particularly attracted to the boys at her school, no matter how hard her best friend, Vee, pushes them at her. Not until Patch comes along. With his easy smile and eyes that seem to see inside her, Patch draws Nora to him against her better judgment.But after a series of terrifying encounters, Nora's not sure whom to trust. Patch seems to be everywhere she is and seems to know more about her than her closest friends. She can't decide whether she should fall into his arms or run and hide. And when she tries to seek some answers, she finds herself near a truth that is way more unsettling than anything Patch makes her feel.For she is right in the middle of an ancient battle between the immortal and those that have fallen - and, when it comes to choosing sides, the wrong choice will cost Nora her life.","['Fantasy', 'Young Adult', 'Romance', 'Paranormal', 'Angels', 'Paranormal Romance', 'Fiction']"
1,Twilight,Stephenie Meyer,"About three things I was absolutely positive.First, Edward was a vampire.Second, there was a part of him - and I didn't know how dominant that part might be - that thirsted for my blood.And third, I was unconditionally and irrevocably in love with him.Deeply seductive and extraordinarily suspenseful, Twilight is a love story with bite.","['Fantasy', 'Young Adult', 'Romance', 'Fiction', 'Vampires', 'Paranormal', 'Paranormal Romance']"
2,The Thirteenth Tale,Diane Setterfield,"All children mythologize their birth...So begins the prologue of reclusive author Vida Winter's collection of stories, which are as famous for the mystery of the missing thirteenth tale as they are for the delight and enchantment of the twelve that do exist. The enigmatic Winter has spent six decades creating various outlandish life histories for herself -- all of them inventions that have brought her fame and fortune but have kept her violent and tragic past a secret. Now old and ailing, she at last wants to tell the truth about her extraordinary life. She summons biographer Margaret Lea, a young woman for whom the secret of her own birth, hidden by those who loved her most, remains an ever-present pain. Struck by a curious parallel between Miss Winter's story and her own, Margaret takes on the commission. As Vida disinters the life she meant to bury for good, Margaret is mesmerized. It is a tale of gothic strangeness featuring the Angelfield family, including the beautiful and willful Isabelle, the feral twins Adeline and Emmeline, a ghost, a governess, a topiary garden and a devastating fire. Margaret succumbs to the power of Vida's storytelling but remains suspicious of the author's sincerity. She demands the truth from Vida, and together they confront the ghosts that have haunted them while becoming, finally, transformed by the truth themselves. The Thirteenth Tale is a love letter to reading, a book for the feral reader in all of us, a return to that rich vein of storytelling that our parents loved and that we loved as children. Diane Setterfield will keep you guessing, make you wonder, move you to tears and laughter and, in the end, deposit you breathless yet satisfied back upon the shore of your everyday life.","['Fiction', 'Mystery', 'Historical Fiction', 'Gothic', 'Books About Books', 'Fantasy', 'Adult']"
3,New Moon,"Stephenie Meyer, Sylke Hachmeister (Translator)","There is an alternate cover edition for ISBN13 9780316160193 here. I knew we were both in mortal danger. Still, in that instant, I felt well. Whole. I could feel my heart racing in my chest, the blood pulsing hot and fast through my veins again. My lungs filled deep with the sweet scent that came off his skin. It was like there had never been any hole in my chest. I was perfect - not healed, but as if there had never been a wound in the first place. I FELT LIKE I WAS TRAPPED IN ONE OF THOSE TERRIFYING NIGHTMARES, the one where you have to run, run till your lungs burst, but you can't make your body move fast enough.... But this was no dream, and, unlike the nightmare, I wasn't running for my life; I was racing to save something infinitely more precious. My own life meant little to me today. FOR BELLA SWAN THERE IS ONE THING more important than life itself: Edward Cullen. But being in love with a vampire is even more dangerous than Bella could ever have imagined. Edward has already rescued Bella from the clutches of one evil vampire, but now, as their daring relationship threatens all that is near and dear to them, they realize their troubles may be just beginning....LEGIONS OF READERS ENTRANCED BY THE New York Times bestseller Twilight are hungry for the continuing story of star-crossed lovers Bell and Edward. In New Moon, Stephanie Meyer delivers another irresistible combination of romance and suspense with a supernatural spin. passionate, riveting, and full of surprising twists and turns, this vampire love saga is well on its way to literary immortality.","['Fantasy', 'Young Adult', 'Romance', 'Vampires', 'Fiction', 'Paranormal', 'Paranormal Romance']"
4,Fallen,Lauren Kate,"There’s something achingly familiar about Daniel Grigori.Mysterious and aloof, he captures Luce Price’s attention from the moment she sees him on her first day at the Sword & Cross boarding school in sultry Savannah, Georgia. He’s the one bright spot in a place where cell phones are forbidden, the other students are all screw-ups, and security cameras watch every move.Even though Daniel wants nothing to do with Luce—and goes out of his way to make that very clear—she can’t let it go. Drawn to him like a moth to a flame, she has to find out what Daniel is so desperate to keep secret… even if it kills her.","['Fantasy', 'Young Adult', 'Romance', 'Paranormal', 'Angels', 'Paranormal Romance', 'Fiction']"
5,Shiver,Maggie Stiefvater,"For years, Grace has watched the wolves in the woods behind her house. One yellow-eyed wolf—her wolf—is a chilling presence she can't seem to live without.Meanwhile, Sam has lived two lives: In winter, the frozen woods, the protection of the pack, and the silent company of a fearless girl. In summer, a few precious months of being human… until the cold makes him shift back again.Now, Grace meets a yellow-eyed boy whose familiarity takes her breath away. It's her wolf. It has to be. But as winter nears, Sam must fight to stay human—or risk losing himself, and Grace, forever.","['Young Adult', 'Fantasy', 'Romance', 'Paranormal', 'Werewolves', 'Fiction', 'Paranormal Romance']"
6,Breaking Dawn,Stephenie Meyer,"""Don't be afraid,"" I murmured. ""We belong together.""I was abruptly overwhelmed by the truth of my own words. This moment was so perfect, so right, there was no way to doubt it.His arms wrapped around me,holding me against him....It felt like every nerve ending in my body was a live wire.""Forever,"" he agreed.WHEN YOU LOVED THE ONE WHO WAS KILLING YOU, IT LEFT YOU NO OPTIONS. How could you run, how could you fight, when doing so would hurt that beloved one? If your life was all you had to give, how could you not give it? If it was someone you truly loved?TO BE IRREVOCABLY IN LOVE WITH A VAMPIRE is both fantasy and nightmare woven into a dangerously heightened reality for Bella Swan. Pulled in one direction by her intense passion for Edward Cullen, and in another by her profound connection to werewolf Jacob Black, a tumultuous year of temptation, loss, and strife have led her to the ultimate turning point. Her imminent choice to either join the dark but seductive world of immortals or to pursue a fully human life has become the thread from which the fates of two tribes hangs.NOW THAT BELLA HAS MADE HER DECISION, a startling chain of unprecedented events is about to unfold with potentially devastating, and unfathomable, consequences. Just when the frayed strands of Bella's life - first discovered in Twilight, then scattered and torn in New Moon and Eclipse - seem ready to heal and knit together, could they be destroyed... forever?THE ASTONISHING, BREATHLESSLY anticipated conclusion to the Twilight Saga, Breaking Dawn illuminates the secrets and mysteries of this spellbinding romantic epic that has entranced millions.","['Fantasy', 'Young Adult', 'Romance', 'Vampires', 'Fiction', 'Paranormal', 'Paranormal Romance']"
7,Memoirs of a Geisha,Arthur Golden,"A literary sensation and runaway bestseller, this brilliant novel presents with seamless authenticity and exquisite lyricism the true confessions of one of Japan's most celebrated geisha.In ""Memoirs of a Geisha,"" we enter a world where appearances are paramount; where a girl's virginity is auctioned to the highest bidder; where women are trained to beguile the most powerful men; and where love is scorned as illusion. It is a unique and triumphant work of fiction - at once romantic, erotic, suspenseful - and completely unforgettable.","['Fiction', 'Historical Fiction', 'Romance', 'Historical', 'Japan', 'Adult', 'Novels']"
8,"Oh, the Places You’ll Go!",Dr. Seuss,"For out-starting upstarts of all ages, here is a wonderfully wise and blessedly brief graduation speech from the one and only Dr. Seuss!In his inimitable, humorous verse and pictures, he addresses the Great Balancing Act (life itself, and the ups and downs it presents) while encouraging us to find the success that lies within us.""And will you succeed?Yes! You will indeed!(98 and ¾ percent guaranteed.)""A modern classic, Oh, the Places You'll Go! was first published one year before Dr. Seuss's death at the age of eighty-seven. In a mere fifty-six pages, Dr, Seuss managed to impart a lifetime of wisdom. It is the perfect send-off for children starting out in the maze of life, be they nursery school grads or newly-minted PhD's. Everyone will find it inspired good fun.With his unique combination of hilarious stories, zany pictures and riotous rhymes, Dr. Seuss has been delighting young children and helping them learn to read for over fifty years. Creator of the wonderfully anarchic 'Cat in the Hat', and ranked among the world's top children's authors, Dr. Seuss is a global best-seller, with nearly half a billion books sold worldwide.","['Childrens', 'Picture Books', 'Fiction', 'Classics', 'Poetry', 'Fantasy', 'Young Adult']"
9,Eclipse,Stephenie Meyer,"""BELLA?""Edward's soft voice came from behind me. I turned to see him spring lightly up the porch steps, his hair windblown from running. He pulled me into his arms at once, just like he had in the parking lot, and kissed me again.This kiss frightened me. There was too much tension, too strong an edge to the way his lips crushed mine - like he was afraid we had only so much time left to us.As Seattle is ravaged by a string of mysterious killings and a malicious vampire continues her quest for revenge, Bella once again finds herself surrounded by danger. In the midst of it all, she is forced to choose between her love for Edward and her friendship with Jacob - knowing that her decision has the potential to ignite the ageless struggle between vampire and werewolf. With her graduation quickly approaching, Bella has one more decision to make: life or death. But which is which?READERS CAPTIVATED BY Twilight AND New Moon will eagerly devour Eclipse, the much-anticipated third book in Stephenie Meyer's riveting vampire love saga.","['Fantasy', 'Young Adult', 'Romance', 'Vampires', 'Fiction', 'Paranormal', 'Paranormal Romance']"
10,City of Bones,Cassandra Clare,"When fifteen-year-old Clary Fray heads out to the Pandemonium Club in New York City, she hardly expects to witness a murder― much less a murder committed by three teenagers covered with strange tattoos and brandishing bizarre weapons. Then the body disappears into thin air. It's hard to call the police when the murderers are invisible to everyone else and when there is nothing―not even a smear of blood―to show that a boy has died. Or was he a boy?This is Clary's first meeting with the Shadowhunters, warriors dedicated to ridding the earth of demons. It's also her first encounter with Jace, a Shadowhunter who looks a little like an angel and acts a lot like a jerk. Within twenty-four hours Clary is pulled into Jace's world with a vengeance when her mother disappears and Clary herself is attacked by a demon. But why would demons be interested in ordinary mundanes like Clary and her mother? And how did Clary suddenly get the Sight? The Shadowhunters would like to know...","['Fantasy', 'Young Adult', 'Romance', 'Paranormal', 'Urban Fantasy', 'Fiction', 'Vampires']"
11,Clockwork Angel,Cassandra Clare,"In a time when Shadowhunters are barely winning the fight against the forces of darkness, one battle will change the course of history forever. Welcome to the Infernal Devices trilogy, a stunning and dangerous prequel to the New York Times bestselling Mortal Instruments series.The year is 1878. Tessa Gray descends into London’s dark supernatural underworld in search of her missing brother. She soon discovers that her only allies are the demon-slaying Shadowhunters—including Will and Jem, the mysterious boys she is attracted to. Soon they find themselves up against the Pandemonium Club, a secret organization of vampires, demons, warlocks, and humans. Equipped with a magical army of unstoppable clockwork creatures, the Club is out to rule the British Empire, and only Tessa and her allies can stop them...","['Fantasy', 'Young Adult', 'Romance', 'Paranormal', 'Steampunk', 'Historical Fiction', 'Fiction']"
12,Pride and Prejudice and Zombies,"Seth Grahame-Smith, Jane Austen","“It is a truth universally acknowledged that a zombie in possession of brains must be in want of more brains.”So begins Pride and Prejudice and Zombies, an expanded edition of the beloved Jane Austen novel featuring all-new scenes of bone-crunching zombie mayhem. As our story opens, a mysterious plague has fallen upon the quiet English village of Meryton—and the dead are returning to life! Feisty heroine Elizabeth Bennet is determined to wipe out the zombie menace, but she’s soon distracted by the arrival of the haughty and arrogant Mr. Darcy. What ensues is a delightful comedy of manners with plenty of civilized sparring between the two young lovers—and even more violent sparring on the blood-soaked battlefield. Can Elizabeth vanquish the spawn of Satan? And overcome the social prejudices of the class-conscious landed gentry? Complete with romance, heartbreak, swordfights, cannibalism, and thousands of rotting corpses,","['Horror', 'Fiction', 'Fantasy', 'Zombies', 'Humor', 'Romance', 'Classics']"
13,The Host,Stephenie Meyer,"Melanie Stryder refuses to fade away. The earth has been invaded by a species that take over the minds of human hosts while leaving their bodies intact. Wanderer, the invading ""soul"" who has been given Melanie's body, didn't expect to find its former tenant refusing to relinquish possession of her mind.As Melanie fills Wanderer's thoughts with visions of Jared, a human who still lives in hiding, Wanderer begins to yearn for a man she's never met. Reluctant allies, Wanderer and Melanie set off to search for the man they both love.Also see: Alternate Cover Editions for this ISBN [ACE]  
ACE #1
 - 
ACE #2
","['Young Adult', 'Fantasy', 'Science Fiction', 'Romance', 'Fiction', 'Dystopia', 'Paranormal']"
14,Halo,Alexandra Adornetto,"An angel is sent to Earth on a mission.But falling in love is not part of the plan.Three angels – Gabriel, the warrior; Ivy, the healer; and Bethany, the youngest and most human – are sent by Heaven to bring good to a world falling under the influence of darkness. They work hard to conceal their luminous glow, superhuman powers, and, most dangerous of all, their wings, all the while avoiding all human attachments.Then Bethany meets Xavier Woods, and neither of them is able to resist the attraction between them. Gabriel and Ivy do everything in their power to intervene, but the bond between Xavier and Bethany seems too strong.The angel’s mission is urgent, and dark forces are threatening. Will love ruin Bethany or save her?","['Young Adult', 'Angels', 'Fantasy', 'Romance', 'Paranormal', 'Paranormal Romance', 'Supernatural']"
15,Wicked Lovely,Melissa Marr,"Rule #3: Don't stare at invisible faeries.Aislinn has always seen faeries. Powerful and dangerous, they walk hidden in the mortal world. Aislinn fears their cruelty - especially if they learn of her Sight - and wishes she were as blind to their presence as other teens.Rule #2: Don't speak to invisible faeries.Now faeries are stalking her. One of them, Keenan, who is equal parts terrifying and alluring, is trying to talk to her, asking questions Aislinn is afraid to answer.Rule #1: Don't ever attract their attention.But it's too late. Keenan is the Summer King, who has sought his queen for nine centuries. Without her, summer itself will perish. He is determined that Aislinn will become the Summer Queen at any cost — regardless of her plans or desires.Suddenly none of the rules that have kept Aislinn safe are working anymore, and everything is on the line: her freedom; her best friend, Seth; her life; everything.Faery intrigue, mortal love, and the clash of ancient rules and modern expectations swirl together in Melissa Marr's stunning twenty-first-century faery tale.","['Fantasy', 'Young Adult', 'Romance', 'Urban Fantasy', 'Fae', 'Fairies', 'Fiction']"
16,A Great and Terrible Beauty,Libba Bray,"In this debut gothic novel mysterious visions, dark family secrets and a long-lost diary thrust Gemma and her classmates back into the horrors that followed her from India. (Ages 12+)It's 1895, and after the suicide of her mother, 16-year-old Gemma Doyle is shipped off from the life she knows in India to Spence, a proper boarding school in England. Lonely, guilt-ridden, and prone to visions of the future that have an uncomfortable habit of coming true, Gemma's reception there is a chilly one. To make things worse, she's been followed by a mysterious young Indian man, a man sent to watch her. But why? What is her destiny? And what will her entanglement with Spence's most powerful girls—and their foray into the spiritual world—lead to?","['Fantasy', 'Young Adult', 'Historical Fiction', 'Fiction', 'Historical', 'Paranormal', 'Romance']"
17,To Kill a Mockingbird,Harper Lee,"The unforgettable novel of a childhood in a sleepy Southern town and the crisis of conscience that rocked it. ""To Kill A Mockingbird"" became both an instant bestseller and a critical success when it was first published in 1960. It went on to win the Pulitzer Prize in 1961 and was later made into an Academy Award-winning film, also a classic.Compassionate, dramatic, and deeply moving, ""To Kill A Mockingbird"" takes readers to the roots of human behavior - to innocence and experience, kindness and cruelty, love and hatred, humor and pathos. Now with over 18 million copies in print and translated into forty languages, this regional story by a young Alabama woman claims universal appeal. Harper Lee always considered her book to be a simple love story. Today it is regarded as a masterpiece of American literature.","['Classics', 'Fiction', 'Historical Fiction', 'School', 'Literature', 'Young Adult', 'Historical']"
18,Water for Elephants,Sara Gruen,"When Jacob Jankowski, recently orphaned and suddenly adrift, jumps onto a passing train, he enters a world of freaks, drifters, and misfits, a second-rate circus struggling to survive during the Great Depression, making one-night stands in town after endless town. A veterinary student who almost earned his degree, Jacob is put in charge of caring for the circus menagerie. It is there that he meets Marlena, the beautiful young star of the equestrian act, who is married to August, the charismatic but twisted animal trainer. He also meets Rosie, an elephant who seems untrainable until he discovers a way to reach her. Beautifully written, Water for Elephants is illuminated by a wonderful sense of time and place. It tells a story of a love between two people that overcomes incredible odds in a world in which even love is a luxury that few can afford.","['Fiction', 'Historical Fiction', 'Romance', 'Historical', 'Adult', 'Adult Fiction', 'Contemporary']"
19,The Lightning Thief,Rick Riordan,"Alternate cover for this ISBN can be found herePercy Jackson is a good kid, but he can't seem to focus on his schoolwork or control his temper. And lately, being away at boarding school is only getting worse - Percy could have sworn his pre-algebra teacher turned into a monster and tried to kill him. When Percy's mom finds out, she knows it's time that he knew the truth about where he came from, and that he go to the one place he'll be safe. She sends Percy to Camp Half Blood, a summer camp for demigods (on Long Island), where he learns that the father he never knew is Poseidon, God of the Sea. Soon a mystery unfolds and together with his friends—one a satyr and the other the demigod daughter of Athena - Percy sets out on a quest across the United States to reach the gates of the Underworld (located in a recording studio in Hollywood) and prevent a catastrophic war between the gods.","['Fantasy', 'Young Adult', 'Mythology', 'Fiction', 'Middle Grade', 'Adventure', 'Greek Mythology']"
20,The Hunger Games,Suzanne Collins,"Could you survive on your own in the wild, with every one out to make sure you don't live to see the morning?In the ruins of a place once known as North America lies the nation of Panem, a shining Capitol surrounded by twelve outlying districts. The Capitol is harsh and cruel and keeps the districts in line by forcing them all to send one boy and one girl between the ages of twelve and eighteen to participate in the annual Hunger Games, a fight to the death on live TV.Sixteen-year-old Katniss Everdeen, who lives alone with her mother and younger sister, regards it as a death sentence when she steps forward to take her sister's place in the Games. But Katniss has been close to dead before—and survival, for her, is second nature. Without really meaning to, she becomes a contender. But if she is to win, she will have to start making choices that weight survival against humanity and life against love.","['Young Adult', 'Fiction', 'Fantasy', 'Science Fiction', 'Audiobook', 'Teen', 'Post Apocalyptic']"
21,1984,"George Orwell, Thomas Pynchon (Foreword)",A masterpiece of rebellion and imprisonment where war is peace freedom is slavery and Big Brother is watching Thought Police Big Brother Orwellian These words have entered our vocabulary because of George Orwell s classic dystopian novel 1984 The story of one man s nightmare odyssey as he pursues a forbidden love affair through a world ruled by warring states and a power structure that controls not only information but also individual thought and memory 1984 is a prophetic haunting tale More relevant than ever before 1984 exposes the worst crimes imaginable the destruction of truth freedom and individuality With a foreword by Thomas Pynchon With a foreword by Thomas Pynchon A masterpiece of rebellion and imprisonment where war is peace freedom is slavery and Big Brother is watching View our feature on George Orwell s 1984 Thought Police Big Brother Orwellian These words have entered our vocabulary because of George Orwell s classic dystopian novel 1984 The story of one man s nightmare odyssey as he pursues a forbidden love affair through a world ruled by warring states and a power structure that controls not only information but also individual thought and memory 1984 is a prophetic haunting tale More relevant than ever before 1984 exposes the worst crimes imaginable the destruction of truth freedom and individuality This beautiful paperback edition features deckled edges and french flaps a perfect gift for any occasionAlternate cover edition can be found here.,"['Classics', 'Fiction', 'Science Fiction', 'Dystopia', 'Literature', 'Politics', 'Novels']"
22,Nightshade,Andrea Cremer,"Calla Tor has always known her destiny: After graduating from the Mountain School, she'll be the mate of sexy alpha wolf Ren Laroche and fight with him, side by side, ruling their pack and guarding sacred sites for the Keepers. But when she violates her masters' laws by saving a beautiful human boy out for a hike, Calla begins to question her fate, her existence, and the very essence of the world she has known. By following her heart, she might lose everything- including her own life. Is forbidden love worth the ultimate sacrifice?""A finely-wrought compelling tale of romance and treachery...""-Cynthia Leitich Smith(New York Times bestselling author of Eternal and Tantalize)","['Young Adult', 'Fantasy', 'Paranormal', 'Werewolves', 'Romance', 'Paranormal Romance', 'Supernatural']"
23,Torment,Lauren Kate,"Hell on earth.That’s what it’s like for Luce to be apart from her fallen angel boyfriend, Daniel. It took them an eternity to find one another, but now he has told her he must go away. Just long enough to hunt down the Outcasts—immortals who want to kill Luce. Daniel hides Luce at Shoreline, a school on the rocky California coast with unusually gifted students: Nephilim, the offspring of fallen angels and humans.At Shoreline, Luce learns what the Shadows are, and how she can use them as windows to her previous lives. Yet the more Luce learns, the more she suspects that Daniel hasn’t told her everything. He’s hiding something—something dangerous. What if Daniel’s version of the past isn’t actually true? What if Luce is really meant to be with someone else?","['Young Adult', 'Fantasy', 'Romance', 'Angels', 'Paranormal', 'Paranormal Romance', 'Supernatural']"
