,Book Title,Author,Description,Genre
49,Only Revolutions,Mark Z. Danielewski,"They were with us before Romeo Juliet. And long after too. Because they're forever around. Or so both claim, carolling gleefully ""always sixteen."" Sam and Hailey, powered by an ever-rotating fleet of cars, from Model T to Lincoln Continental, career from the Civil War to the Cold War, barrelling down through the Appalachians, up the Mississippi River, across the Badlands, finally cutting a nation in half as they try to outrace History itself. By turns beguiling and gripping, finally worldwrecking, Only Revolutions is unlike anything ever published before, a remarkable feat of heart and intellect, moving us with the journey of two kids, perpetually of summer, perpetually sixteen, who give up everything except each other.","['Fiction', 'Poetry', 'Fantasy', 'Romance', 'Novels', 'Literature', 'Literary Fiction']"
50,Across the Universe,Beth Revis,"A love out of time. A spaceship built of secrets and murder. Seventeen-year-old Amy joins her parents as frozen cargo aboard the vast spaceship Godspeed and expects to awaken on a new planet, three hundred years in the future. Never could she have known that her frozen slumber would come to an end fifty years too soon and that she would be thrust into the brave new world of a spaceship that lives by its own rules.Amy quickly realizes that her awakening was no mere computer malfunction. Someone—one of the few thousand inhabitants of the spaceship —tried to kill her. And if Amy doesn't do something soon, her parents will be next.Now Amy must race to unlock Godspeed's hidden secrets. But out of her list of murder suspects, there's only one who matters: Elder, the future leader of the ship and the love she could never have seen coming.","['Young Adult', 'Science Fiction', 'Dystopia', 'Romance', 'Fantasy', 'Fiction', 'Mystery']"
51,Ink Exchange,Melissa Marr,"Unbeknownst to mortals, a power struggle is unfolding in a world of shadows and danger. After centuries of stability, the balance among the Faery Courts has altered, and Irial, ruler of the Dark Court, is battling to hold his rebellious and newly vulnerable fey together. If he fails, bloodshed and brutality will follow.Seventeen-year-old Leslie knows nothing of faeries or their intrigues. When she is attracted to an eerily beautiful tattoo of eyes and wings, all she knows is that she has to have it, convinced it is a tangible symbol of changes she desperately craves for her own life.The tattoo does bring changes, but not the kind Leslie has dreamed of, but sinister, compelling changes that are more than symbolic. Those changes will bind Leslie and Irial together, drawing Leslie deeper and deeper into the faery world, unable to resist its allures, and helpless to withstand its perils. . .","['Fantasy', 'Young Adult', 'Paranormal', 'Romance', 'Urban Fantasy', 'Fairies', 'Fae']"
52,The Dark Divine,Bree Despain,"Grace Divine, daughter of the local pastor, always knew something terrible happened the night Daniel Kalbi disappeared--the night she found her brother Jude collapsed on the porch, covered in his own blood--but she has no idea what a truly monstrous secret that night held.The memories her family has tried to bury resurface when Daniel returns, three years later, and enrolls in Grace and Jude's high school. Despite promising Jude she'll stay away, Grace cannot deny her attraction to Daniel's shocking artistic abilities, his way of getting her to look at the world from new angles, and the strange, hungry glint in his eyes.The closer Grace gets to Daniel, the more she jeopardizes her life, as her actions stir resentment in Jude and drive him to embrace the ancient evil Daniel unleashed that horrific night. Grace must discover the truth behind the boy's dark secret...and the cure that can save the ones she loves. But she may have to lay down the ultimate sacrifice to do it--her soul.","['Young Adult', 'Paranormal', 'Fantasy', 'Romance', 'Werewolves', 'Paranormal Romance', 'Supernatural']"
53,Elsewhere,Gabrielle Zevin,"Welcome to Elsewhere. It is warm, with a breeze, and the beaches are marvelous. It's quiet and peaceful. You can't get sick or any older. Curious to see new paintings by Picasso? Swing by one of Elsewhere's museums. Need to talk to someone about your problems? Stop by Marilyn Monroe's psychiatric practice.Elsewhere is where fifteen-year-old Liz Hall ends up, after she has died. It is a place so like Earth, yet completely different. Here Liz will age backward from the day of her death until she becomes a baby again and returns to Earth. But Liz wants to turn sixteen, not fourteen again. She wants to get her driver's license. She wants to graduate from high school and go to college. And now that she's dead, Liz is being forced to live a life she doesn't want with a grandmother she has only just met. And it is not going well. How can Liz let go of the only life she has ever known and embrace a new one? Is it possible that a life lived in reverse is no different from a life lived forward?This moving, often funny book about grief, death, and loss will stay with the reader long after the last page is turned.","['Young Adult', 'Fantasy', 'Fiction', 'Romance', 'Death', 'Teen', 'Paranormal']"
54,The Truth About Forever,Sarah Dessen,"That's what Macy has to look forward to while her boyfriend, Jason, is away at Brain Camp. Days will be spent at a boring job in the library, evenings will be filled with vocabulary drills for the SATs, and spare time will be passed with her mother, the two of them sharing a silent grief at the traumatic loss of Macy's father.But sometimes, unexpected things can happen—things such as the catering job at Wish, with its fun-loving, chaotic crew. Or her sister's project of renovating the neglected beach house, awakening long-buried memories. Things such as meeting Wes, a boy with a past, a taste for Truth-telling, and an amazing artistic talent, the kind of boy who could turn any girl's world upside down. As Macy ventures out of her shell, she begins to question her sheltered life.","['Young Adult', 'Romance', 'Contemporary', 'Fiction', 'Chick Lit', 'Realistic Fiction', 'Teen']"
55,The Iron King,Julie Kagawa,"Meghan Chase has a secret destiny; one she could never have imagined.Something has always felt slightly off in Meghan's life, ever since her father disappeared before her eyes when she was six. She has never quite fit in at school or at home.When a dark stranger begins watching her from afar, and her prankster best friend becomes strangely protective of her, Meghan senses that everything she's known is about to change.But she could never have guessed the truth - that she is the daughter of a mythical faery king and is a pawn in a deadly war. Now Meghan will learn just how far she'll go to save someone she cares about, to stop a mysterious evil, no faery creature dare face; and to find love with a young prince who might rather see her dead than let her touch his icy heart.","['Fantasy', 'Young Adult', 'Romance', 'Paranormal', 'Fae', 'Fairies', 'Urban Fantasy']"
56,Envy,Anna Godbersen,"Gossip Girl meets the Gilded Age in this delicious and compelling novel, the third in the New York Times bestselling series from author Anna Godbersen.In the thrilling third installment of Anna Godbersen’s bestselling Luxe series, Manhattan’s most envied residents appear to have everything they desire: Wealth. Beauty. Happiness. But sometimes the most practiced smiles hide the most scandalous secrets.
Jealous whispers. Old rivalries. New betrayals. This is Manhattan, 1899.
Two months after Elizabeth Holland’s dramatic homecoming, Manhattan eagerly awaits her return to the pinnacle of society. When Elizabeth refuses to rejoin her sister Diana’s side, however, those watching New York’s favorite family begin to suspect that all is not as it seems behind the stately doors of No. 17 Gramercy Park South.Farther uptown, Henry and Penelope Schoonmaker are the city’s most celebrated couple. But despite the glittering diamond ring on Penelope’s finger, the newlyweds share little more than scorn for each other. And while the newspapers call Penelope’s social-climbing best friend, Carolina Broad, an heiress, her fortune—and her fame—is anything but secure.“Mystery, romance, jealousy, betrayal, humor, and gorgeous, historically accurate details. I couldn’t put The Luxe down!” —Cecily von Ziegesar, author of the #1 New York Times bestselling Gossip Girl series","['Historical Fiction', 'Young Adult', 'Romance', 'Historical', 'Fiction', 'Historical Romance', 'Chick Lit']"
57,Looking for Alaska,John Green,"Before. Miles “Pudge” Halter is done with his safe life at home. His whole life has been one big non-event, and his obsession with famous last words has only made him crave “the Great Perhaps” even more (Francois Rabelais, poet). He heads off to the sometimes crazy and anything-but-boring world of Culver Creek Boarding School, and his life becomes the opposite of safe. Because down the hall is Alaska Young. The gorgeous, clever, funny, sexy, self-destructive, screwed up, and utterly fascinating Alaska Young. She is an event unto herself. She pulls Pudge into her world, launches him into the Great Perhaps, and steals his heart. Then. . . . After. Nothing is ever the same.","['Young Adult', 'Fiction', 'Contemporary', 'Romance', 'Realistic Fiction', 'Coming Of Age', 'Teen']"
58,Sisters Red,Jackson Pearce,"Scarlett March lives to hunt the Fenris — the werewolves that took her eye when she was defending her sister Rosie from a brutal attack. Armed with a razor-sharp hatchet and blood-red cloak, Scarlett is an expert at luring and slaying the wolves. She's determined to protect other young girls from a grisly death, and her raging heart will not rest until every single wolf is dead. Rosie March once felt her bond with her sister was unbreakable. Owing Scarlett her life, Rosie hunts ferociously alongside her. But even as more girls' bodies pile up in the city and the Fenris seem to be gaining power, Rosie dreams of a life beyond the wolves. She finds herself drawn to Silas, a young woodsman who is deadly with an ax and Scarlett's only friend — but does loving him mean betraying her sister and all that they've worked for?","['Fantasy', 'Young Adult', 'Retellings', 'Fairy Tales', 'Paranormal', 'Werewolves', 'Romance']"
59,The Gargoyle,Andrew  Davidson,"A young man is fighting for his life. Into his room walks a bewitching woman who believes she can save him. Their journey will have you believing in the impossible. The nameless and beautiful narrator of The Gargoyle is driving along a dark road when he is distracted by what seems to be a flight of arrows. He crashes into a ravine and wakes up in a burns ward, undergoing the tortures of the damned. His life is over - he is now a monster. But in fact it is only just beginning. One day, Marianne Engel, a wild and compelling sculptress of gargoyles, enters his life and tells him that they were once lovers in medieval Germany. In her telling, he was a badly burned mercenary and she was a nun and a scribe who nursed him back to health in the famed monastery of Engelthal. As she spins her tale, Scheherazade fashion, and relates equally mesmerising stories of deathless love in Japan, Greenland, Italy and England, he finds himself drawn back to life - and, finally, to love.","['Fiction', 'Fantasy', 'Historical Fiction', 'Romance', 'Historical', 'Gothic', 'Contemporary']"
60,Where the Wild Things Are,Maurice Sendak,"Max, a wild and naughty boy, is sent to bed without his supper by his exhausted mother. In his room, he imagines sailing far away to a land of Wild Things. Instead of eating him, the Wild Things make Max their king.","['Picture Books', 'Childrens', 'Fiction', 'Classics', 'Fantasy', 'Adventure', 'Young Adult']"
61,The Awakening,Kelley Armstrong,"If you had met me a few weeks ago, you probably would have described me as an average teenage girl - someone normal. Now my life has changed forever and I’m as far away from normal as it gets. A living science experiment - not only can I see ghosts, but I was genetically altered by a sinister organization called Edison Group. What does that mean? For starters. I'm a teenage necromancer whose powers are out of control: I raise the dead without even trying. Trust me, that is not a power you want to have. Ever.Now I’m running for my life with three of my supernatural friends - a charming sorcerer, a cynical werewolf, and a disgruntled witch - and we have to find someone who can help us before the Edison Group finds us first. Or die trying.","['Young Adult', 'Fantasy', 'Paranormal', 'Urban Fantasy', 'Supernatural', 'Romance', 'Magic']"
62,A Million Little Pieces,James Frey,"Intense, unpredictable, and instantly engaging, this is a story of drug and alcohol abuse and rehabilitation as it has never been told before. It is also the introduction of a bold and talented literary voice. Before considering reading this book, please see the BookBrowse note on the book jacket/review page.BookBrowse Note: January 9th 2006: An article in the Smoking Gun claimed that James Frey (author of A Million Little Pieces and My Friend Leonard) fabricated key parts of his books. They cited police records, court documents and interviews with law enforcement agents which belie a number of Frey's claims regarding criminal charges against him, jail terms and his fugitive status.In an interview with the Smoking Gun, Frey admitted that he had 'embellished central details' in A Million Little Pieces and backtracked on claims he made in the book.January 26th 2006. Frey's publisher stated that while it initially stood by him, after further questioning of the author, the house has ""sadly come to the realization that a number of facts have been altered and incidents embellished."" It will be adding a a publisher's note and author's note to all future editions of A Million Little Pieces.","['Fiction', 'Contemporary', 'Psychology', 'Biography Memoir', 'Mental Health', 'Adult', 'Book Club']"
63,The Handmaid’s Tale,Margaret Atwood,"Offred is a Handmaid in the Republic of Gilead. She may leave the home of the Commander and his wife once a day to walk to food markets whose signs are now pictures instead of words because women are no longer allowed to read. She must lie on her back once a month and pray that the Commander makes her pregnant, because in an age of declining births, Offred and the other Handmaids are valued only if their ovaries are viable. Offred can remember the years before, when she lived and made love with her husband, Luke; when she played with and protected her daughter; when she had a job, money of her own, and access to knowledge. But all of that is gone now…Funny, unexpected, horrifying, and altogether convincing, The Handmaid's Tale is at once scathing satire, dire warning, and tour de force.","['Fiction', 'Classics', 'Dystopia', 'Science Fiction', 'Feminism', 'Fantasy', 'Adult']"
64,Wicked: The Life and Times of the Wicked Witch of the West,"Gregory Maguire, Douglas Smith (Illustrator)","When Dorothy triumphed over the Wicked Witch of the West in L. Frank Baum's classic tale we heard only her side of the story. But what about her arch-nemesis, the mysterious Witch? Where did she come from? How did she become so wicked? And what is the true nature of evil?Gregory Maguire creates a fantasy world so rich and vivid that we will never look at Oz the same way again. Wicked is about a land where animals talk and strive to be treated like first-class citizens, Munchkinlanders seek the comfort of middle-class stability, and the Tin Man becomes a victim of domestic violence. And then there is the little green-skinned girl named Elphaba, who will grow up to become the infamous Wicked Witch of the West, a smart, prickly, and misunderstood creature who challenges all our preconceived notions about the nature of good and evil.An astonishingly rich re-creation of the land of Oz, this book retells the story of Elphaba, the Wicked Witch of the West, who wasn't so wicked after all. Taking readers past the yellow brick road and into a phantasmagoric world rich with imagination and allegory, Gregory Maguire just might change the reputation of one of the most sinister characters in literature.","['Fantasy', 'Fiction', 'Adult', 'Retellings', 'Science Fiction Fantasy', 'Witches', 'Adult Fiction']"
65,Rumors,Anna Godbersen,"After bidding good-bye to New York's brightest star, Elizabeth Holland, rumors continue to fly about her untimely demise. All eyes are on those closest to the dearly her mischievous sister, Diana, now the family's only hope for redemption; New York's most notorious cad, Henry Schoon-maker, the flame Elizabeth never extinguished; the seductive Penelope Hayes, poised to claim all that her best friend left behind—including Henry; even Elizabeth's scheming former maid, Lina Broud, who discovers that while money matters and breeding counts, gossip is the new currency. As old friends become rivals, Manhattan's most dazzling socialites find their futures threatened by whispers from the past. In this delicious sequel to The Luxe , nothing is more dangerous than a scandal . . . or more precious than a secret.","['Historical Fiction', 'Young Adult', 'Romance', 'Historical', 'Fiction', 'Chick Lit', 'Historical Romance']"
66,The Brief History of the Dead,Kevin Brockmeier,"From Kevin Brockmeier, one of this generation's most inventive young writers, comes a striking new novel about death, life, and the mysterious place in between. The City is inhabited by those who have departed Earth but are still remembered by the living. They will reside in this afterlife until they are completely forgotten. But the City is shrinking, and the residents clearing out. Some of the holdouts, like Luka Sims, who produces the City’s only newspaper, are wondering what exactly is going on. Others, like Coleman Kinzler, believe it is the beginning of the end. Meanwhile, Laura Byrd is trapped in an Antarctic research station, her supplies are running low, her radio finds only static, and the power is failing. With little choice, Laura sets out across the ice to look for help, but time is running out. Kevin Brockmeier alternates these two storylines to create a lyrical and haunting story about love, loss and the power of memory.","['Fiction', 'Fantasy', 'Science Fiction', 'Horror', 'Death', 'Novels', 'Post Apocalyptic']"
67,Fahrenheit 451,Ray Bradbury,"Sixty years after its original publication, Ray Bradbury’s internationally acclaimed novel Fahrenheit 451 stands as a classic of world literature set in a bleak, dystopian future. Today its message has grown more relevant than ever before.Guy Montag is a fireman. His job is to destroy the most illegal of commodities, the printed book, along with the houses in which they are hidden. Montag never questions the destruction and ruin his actions produce, returning each day to his bland life and wife, Mildred, who spends all day with her television “family.” But when he meets an eccentric young neighbor, Clarisse, who introduces him to a past where people didn’t live in fear and to a present where one sees the world through the ideas in books instead of the mindless chatter of television, Montag begins to question everything he has ever known.","['Fiction', 'Science Fiction', 'Dystopia', 'Classics', 'School', 'Literature', 'Novels']"
68,Watchmen,"Alan Moore, Dave Gibbons (Illustrator/Letterer), John    Higgins (Colorist)","This Hugo Award-winning graphic novel chronicles the fall from grace of a group of super-heroes plagued by all-too-human failings. Along the way, the concept of the super-hero is dissected as the heroes are stalked by an unknown assassin.One of the most influential graphic novels of all time and a perennial best-seller, Watchmen has been studied on college campuses across the nation and is considered a gateway title, leading readers to other graphic novels such as V for Vendetta, Batman: The Dark Knight Returns and The Sandman series.","['Graphic Novels', 'Fiction', 'Science Fiction', 'Fantasy', 'Graphic Novels Comics', 'Classics', 'Comic Book']"
69,Od Magic,Patricia A. McKillip,"Brenden Vetch has a gift. With an innate sense he cannot explain to himself or describe to others, he connects to the agricultural world, nurturing gardens to flourish and instinctively knowing the healing properties each plant and herb has to offer. But Brenden’s gift isolates him from people—and from becoming part of a community.Until the day he receives a personal invitation from the wizard Od. She needs a gardener for her school in the great city of Kelior, where every potential wizard must be trained to serve the Kingdom of Numis. For decades the rulers of Numis have controlled the school, believing they can contain the power within it—and punish any wizard who dares defy the law.But unknown to the reigning monarchy is the power possessed by the school’s new gardener—a power that even Brenden isn’t fully aware of, and which is the true reason Od recruited him...","['Fantasy', 'Fiction', 'Magic', 'Young Adult', 'Science Fiction Fantasy', 'High Fantasy', 'Adult']"
70,The Sweet Far Thing,Libba Bray,"It has been a year of change since Gemma Doyle arrived at the foreboding Spence Academy. Her mother murdered, her father a laudanum addict, Gemma has relied on an unsuspected strength and has discovered an ability to travel to an enchanted world called the realms, where dark magic runs wild. Despite certain peril, Gemma has bound the magic to herself and forged unlikely new alliances. Now, as Gemma approaches her London debut, the time has come to test these bonds. The Order - the mysterious group her mother was once part of - is grappling for control of the realms, as is the Rakshana. Spence's burned East Wing is being rebuilt, but why now? Gemma and her friends see Pippa, but she is not the same. And their friendship faces its gravest trial as Gemma must decide once and for all what role she is meant for.","['Fantasy', 'Young Adult', 'Historical Fiction', 'Historical', 'Fiction', 'Romance', 'Paranormal']"
71,Howl’s Moving Castle,Diana Wynne Jones,"Sophie has the great misfortune of being the eldest of three daughters, destined to fail miserably should she ever leave home to seek her fate. But when she unwittingly attracts the ire of the Witch of the Waste, Sophie finds herself under a horrid spell that transforms her into an old lady. Her only chance at breaking it lies in the ever-moving castle in the hills: the Wizard Howl's castle. To untangle the enchantment, Sophie must handle the heartless Howl, strike a bargain with a fire demon, and meet the Witch of the Waste head-on. Along the way, she discovers that there's far more to Howl—and herself—than first meets the eye.An alternative cover for this ISBN can be found here","['Fantasy', 'Young Adult', 'Fiction', 'Middle Grade', 'Magic', 'Classics', 'Childrens']"
72,Daughter of the Flames,Zoë Marriott,"Zahira is a young woman of the conquered Rua people, their country occupied by another, very different culture - the Sedorne. Zahira is an orphan and has been raised to despise and distrust the occupying population, as well as to be a devout follower of the native religion. But everything changes for Zahira when her home and foster family are destroyed and she finds out some shocking truths about her heritage and real family. Realizing that it is up to her to do something about the violence and upheaval that are tearing her country apart, she must learn to accept her Sedorne origins and try to bridge the gap between the warring cultures. But when her own people suspect her of treachery for her ideas - especially after she saves the life of a Sedorne nobleman and begins to fall in love - the epic task ahead of her seems insurmountable...","['Fantasy', 'Young Adult', 'Romance', 'Fiction', 'Young Adult Fantasy', 'Magic', 'Adventure']"
73,Peter and the Shadow Thieves,"Dave Barry, Ridley Pearson, Greg Call (Illustrations)","In this riveting and adventure-packed follow-up to the award-winning New York Times bestseller Peter and the Starcatchers, Peter leaves the relative safety of Mollusk Island - along with his trusted companion, Tinker Bell - for the dark and dangerous streets of London. On a difficult journey across the sea, he and Tink discover the mysterious and deadly Lord Ombra, who is intent on recovering the missing starstuff - celestial dust that contains unimagined powers. In London, Peter attempts to track down the indomitable Molly, hoping that together they can combat Ombra's determined forces. But London is not Mollusk Island; Peter is not the boy he used to be; and Lord Ombra - the Shadow Master - is unlike anything Peter, or the world, has ever seen.Dave Barry and Ridley Pearson have done it again - written a compulsively readable, magical, impossible-to-put-down tale that will delight readers of all ages.","['Fantasy', 'Young Adult', 'Fiction', 'Adventure', 'Middle Grade', 'Childrens', 'Magic']"
