,Book Title,Author,Description,Genre
24,The Luxe,Anna Godbersen,"Pretty girls in pretty dresses, partying until dawn. Irresistible boys with mischievous smiles and dangerous intentions. White lies, dark secrets, and scandalous hookups. This is Manhattan, 1899. Beautiful sisters Elizabeth and Diana Holland rule Manhattan's social scene. Or so it appears. When the girls discover their status among New York City's elite is far from secure, suddenly everyone--from the backstabbing socialite Penelope Hayes, to the debonair bachelor Henry Schoonmaker, to the spiteful maid Lina Broud--threatens Elizabeth's and Diana's golden future. With the fate of the Hollands resting on her shoulders, Elizabeth must choose between family duty and true love. But when her carriage overturns near the East River, the girl whose glittering life lit up the city's gossip pages is swallowed by the rough current. As all of New York grieves, some begin to wonder whether life at the top proved too much for this ethereal beauty, or if, perhaps, someone wanted to see Manhattan's most celebrated daughter disappear... In a world of luxury and deception, where appearance matters above everything and breaking the social code means running the risk of being ostracized forever, five teenagers lead dangerously scandalous lives. This thrilling trip to the age of innocence is anything but innocent.","['Historical Fiction', 'Young Adult', 'Romance', 'Historical', 'Fiction', 'Historical Romance', 'Chick Lit']"
25,Speak,Laurie Halse Anderson,"The first ten lies they tell you in high school.""Speak up for yourself—we want to know what you have to say."" From the first moment of her freshman year at Merryweather High, Melinda knows this is a big fat lie, part of the nonsense of high school. She is friendless, outcast, because she busted an end-of-summer party by calling the cops, so now nobody will talk to her, let alone listen to her. As time passes, she becomes increasingly isolated and practically stops talking altogether. Only her art class offers any solace, and it is through her work on an art project that she is finally able to face what really happened at that terrible party: she was raped by an upperclassman, a guy who still attends Merryweather and is still a threat to her. Her healing process has just begun when she has another violent encounter with him. But this time Melinda fights back, refuses to be silent, and thereby achieves a measure of vindication. In Laurie Halse Anderson's powerful novel, an utterly believable heroine with a bitterly ironic voice delivers a blow to the hypocritical world of high school. She speaks for many a disenfranchised teenager while demonstrating the importance of speaking up for oneself.Speak was a 1999 National Book Award Finalist for Young People's Literature.","['Young Adult', 'Fiction', 'Contemporary', 'Realistic Fiction', 'Mental Health', 'Coming Of Age', 'Teen']"
26,The Book Thief,Markus Zusak,"Librarian's note: An alternate cover edition can be found hereIt is 1939. Nazi Germany. The country is holding its breath. Death has never been busier, and will be busier still.By her brother's graveside, Liesel's life is changed when she picks up a single object, partially hidden in the snow. It is The Gravedigger's Handbook, left behind there by accident, and it is her first act of book thievery. So begins a love affair with books and words, as Liesel, with the help of her accordian-playing foster father, learns to read. Soon she is stealing books from Nazi book-burnings, the mayor's wife's library, wherever there are books to be found.But these are dangerous times. When Liesel's foster family hides a Jew in their basement, Liesel's world is both opened up, and closed down.In superbly crafted writing that burns with intensity, award-winning author Markus Zusak has given us one of the most enduring stories of our time.(Note: this title was not published as YA fiction)","['Historical Fiction', 'Fiction', 'Young Adult', 'Classics', 'Historical', 'War', 'World War II']"
27,The Book of Lost Things,John Connolly,"High in his attic bedroom, twelve-year-old David mourns the death of his mother, with only the books on his shelf for company. But those books have begun to whisper to him in the darkness. Angry and alone, he takes refuge in his imagination and soon finds that reality and fantasy have begun to meld. While his family falls apart around him, David is violently propelled into a world that is a strange reflection of his own -- populated by heroes and monsters and ruled by a faded king who keeps his secrets in a mysterious book, The Book of Lost Things.Taking readers on a vivid journey through the loss of innocence into adulthood and beyond, New York Times bestselling author John Connolly tells a dark and compelling tale that reminds us of the enduring power of stories in our lives.","['Fantasy', 'Fiction', 'Young Adult', 'Horror', 'Fairy Tales', 'Books About Books', 'Adventure']"
28,Coraline,"Neil Gaiman, Dave McKean (illustrator)","The day after they moved in, Coraline went exploring....In Coraline's family's new flat are twenty-one windows and fourteen doors. Thirteen of the doors open and close. The fourteenth is locked, and on the other side is only a brick wall, until the day Coraline unlocks the door to find a passage to another flat in another house just like her own. Only it's different. At first, things seem marvelous in the other flat. The food is better. The toy box is filled with wind-up angels that flutter around the bedroom, books whose pictures writhe and crawl and shimmer, little dinosaur skulls that chatter their teeth. But there's another mother, and another father, and they want Coraline to stay with them and be their little girl. They want to change her and never let her go. Other children are trapped there as well, lost souls behind the mirrors. Coraline is their only hope of rescue. She will have to fight with all her wits and all the tools she can find if she is to save the lost children, her ordinary life, and herself. Critically acclaimed and award-winning author Neil Gaiman will delight readers with his first novel for all ages.","['Fantasy', 'Horror', 'Fiction', 'Young Adult', 'Middle Grade', 'Childrens', 'Paranormal']"
29,Uglies,Scott Westerfeld,"Tally is about to turn sixteen, and she can't wait. In just a few weeks she'll have the operation that will turn her from a repellent ugly into a stunning pretty. And as a pretty, she'll be catapulted into a high-tech paradise where her only job is to have fun.But Tally's new friend Shay isn't sure she wants to become a pretty. When Shay runs away, Tally learns about a whole new side of the pretty world—and it isn't very pretty. The authorities offer Tally a choice: find her friend and turn her in, or never turn pretty at all. Tally's choice will change her world forever....","['Young Adult', 'Dystopia', 'Science Fiction', 'Fiction', 'Fantasy', 'Romance', 'Teen']"
30,Tithe,Holly Black,"Welcome to the realm of very scary faeries!Sixteen-year-old Kaye is a modern nomad. Fierce and independent, she travels from city to city with her mother's rock band until an ominous attack forces Kaye back to her childhood home. There, amid the industrial, blue-collar New Jersey backdrop, Kaye soon finds herself an unwilling pawn in an ancient power struggle between two rival faerie kingdoms - a struggle that could very well mean her death.","['Fantasy', 'Young Adult', 'Urban Fantasy', 'Fae', 'Romance', 'Fiction', 'Paranormal']"
31,Matched,Ally Condie,"In the Society, officials decide. Who you love. Where you work. When you die.Cassia has always trusted their choices. It’s hardly any price to pay for a long life, the perfect job, the ideal mate. So when her best friend appears on the Matching screen, Cassia knows with complete certainty that he is the one…until she sees another face flash for an instant before the screen fades to black. Now Cassia is faced with impossible choices: between Xander and Ky, between the only life she’s known and a path no one else has ever dared follow—between perfection and passion.Matched is a story for right now and storytelling with the resonance of a classic.","['Young Adult', 'Dystopia', 'Romance', 'Science Fiction', 'Fantasy', 'Fiction', 'Teen']"
32,The Monsters of Templeton,Lauren Groff,"""The day I returned to Templeton steeped in disgrace, the fifty-foot corpse of a monster surfaced in Lake Glimmerglass."" So begins The Monsters of Templeton, a novel spanning two centuries: part a contemporary story of a girl's search for her father, part historical novel, and part ghost story, this spellbinding novel is at its core a tale of how one town holds the secrets of a family. In the wake of a wildly disastrous affair with her married archeology professor, Willie Upton arrives on the doorstep of her ancestral home in Templeton, New York, where her hippie-turned-born-again-Baptist mom, Vi, still lives. Willie expects to be able to hide in the place that has been home to her family for generations, but the monster's death changes the fabric of the quiet, picture-perfect town her ancestors founded. Even further, Willie learns that the story her mother had always told her about her father has all been a lie: he wasn't the random man from a free-love commune that Vi had led her to imagine, but someone else entirely. Someone from this very town. As Willie puts her archaeological skills to work digging for the truth about her lineage, she discovers that the secrets of her family run deep. Through letters, editorials, and journal entries, the dead rise up to tell their sides of the story as dark mysteries come to light, past and present blur, old stories are finally put to rest, and the shocking truth about more than one monster is revealed.","['Fiction', 'Mystery', 'Fantasy', 'Historical Fiction', 'Magical Realism', 'Literary Fiction', 'Contemporary']"
33,The Great Gatsby,F. Scott Fitzgerald,"The Great Gatsby, F. Scott Fitzgerald's third book, stands as the supreme achievement of his career. This exemplary novel of the Jazz Age has been acclaimed by generations of readers. The story of the fabulously wealthy Jay Gatsby and his love for the beautiful Daisy Buchanan, of lavish parties on Long Island at a time when The New York Times noted ""gin was the national drink and sex the national obsession,"" it is an exquisitely crafted tale of America in the 1920s.The Great Gatsby is one of the great classics of twentieth-century literature.(from the back cover)","['Fiction', 'School', 'Historical Fiction', 'Romance', 'Literature', 'Novels', 'Read For School']"
34,The Time Traveler’s Wife,Audrey Niffenegger,"This is the extraordinary love story of Clare and Henry, who met when Clare was six and Henry was thirty-six, and were married when Clare was twenty-two and Henry was thirty. Impossible but true, because Henry suffers from a rare condition where his genetic clock periodically resets and he finds himself pulled suddenly into his past or future. In the face of this force they can neither prevent nor control, Henry and Clare’s struggle to lead normal lives is both intensely moving and entirely unforgettable.","['Fiction', 'Romance', 'Fantasy', 'Time Travel', 'Science Fiction', 'Contemporary', 'Adult']"
35,Evermore,Alyson Noel,"The first book in Alyson Noël's extraordinary new Immortals series. Enter an enchanting new world, where true love never dies...After a horrible accident claims the lives of her family, sixteen-year-old Ever Bloom can see people's auras, hear their thoughts, and know someone's entire life story by touching them. Going out of her way to avoid human contact to suppress her abilities, she has been branded a freak at her new high school—but everything changes when she meets Damen Auguste.Damen is gorgeous, exotic and wealthy. He's the only one who can silence the noise and random energy in her head—wielding a magic so intense, it's as though he can peer straight into her soul. As Ever is drawn deeper into his enticing world of secrets and mystery, she's left with more questions than answers. And she has no idea just who he really is—or what he is. The only thing she knows to be true is that she's falling deeply and helplessly in love with him.","['Young Adult', 'Fantasy', 'Paranormal', 'Romance', 'Paranormal Romance', 'Fiction', 'Supernatural']"
36,The Curious Incident of the Dog in the Night-Time,Mark Haddon,"Christopher John Francis Boone knows all the countries of the world and their capitals and every prime number up to 7,057. He relates well to animals but has no understanding of human emotions. He cannot stand to be touched. And he detests the color yellow. This improbable story of Christopher’s quest to investigate the suspicious death of a neighborhood dog makes for one of the most captivating, unusual, and widely heralded novels in recent years.","['Fiction', 'Mystery', 'Young Adult', 'Classics', 'Autistic Spectrum Disorder', 'Novels', 'Contemporary']"
37,Masquerade,Melissa de la Cruz,"Schuyler Van Alen is starting to get more comfortable with her newfound vampire powers, but she still has many unanswered questions. A trip to Italy in search of her grandfather only serves to make things more confusing. What secrets are the leaders of The Committee hiding? Meanwhile, back in New York, preparations are feverishly underway for the famous Four Hundred Ball. In true Blue Blood fashion, the ball is totally fab, complete with masksâ€”and hidden behind this masquerade is a revelation that will change the course of a young vampireâ€™s destiny.The thrilling sequel in Melissa de la Cruzâ€™s vampire mythology has all the glamour, attitude, and vampire lore that made the first book a hit.","['Young Adult', 'Vampires', 'Fantasy', 'Paranormal', 'Romance', 'Supernatural', 'Angels']"
38,The Hobbit,"J.R.R. Tolkien, Douglas A. Anderson, Michael Hague (Illustrator) ...more","In a hole in the ground there lived a hobbit. Not a nasty, dirty, wet hole, filled with the ends of worms and an oozy smell, nor yet a dry, bare, sandy hole with nothing in it to sit down on or to eat: it was a hobbit-hole, and that means comfort.Written for J.R.R. Tolkien’s own children, The Hobbit met with instant critical acclaim when it was first published in 1937. Now recognized as a timeless classic, this introduction to the hobbit Bilbo Baggins, the wizard Gandalf, Gollum, and the spectacular world of Middle-earth recounts of the adventures of a reluctant hero, a powerful and dangerous ring, and the cruel dragon Smaug the Magnificent. The text in this 372-page paperback edition is based on that first published in Great Britain by Collins Modern Classics (1998), and includes a note on the text by Douglas A. Anderson (2001).","['Fantasy', 'Classics', 'Fiction', 'Adventure', 'Young Adult', 'High Fantasy', 'Science Fiction Fantasy']"
39,Graceling,Kristin Cashore,"Katsa has been able to kill a man with her bare hands since she was eight—she’s a Graceling, one of the rare people in her land born with an extreme skill. As niece of the king, she should be able to live a life of privilege, but Graced as she is with killing, she is forced to work as the king’s thug. She never expects to fall in love with beautiful Prince Po. She never expects to learn the truth behind her Grace—or the terrible secret that lies hidden far away . . . a secret that could destroy all seven kingdoms with words alone. With elegant, evocative prose and a cast of unforgettable characters, debut author Kristin Cashore creates a mesmerizing world, a death-defying adventure, and a heart-racing romance that will consume you, hold you captive, and leave you wanting more.","['Fantasy', 'Young Adult', 'Romance', 'Fiction', 'Young Adult Fantasy', 'Adventure', 'Magic']"
40,City of Ashes,Cassandra Clare,"Also see: Alternate Cover Editions for this ISBN [ACE]  
ACE #1
Clary Fray just wishes that her life would go back to normal. But what's normal when you're a demon-slaying Shadowhunter, your mother is in a magically induced coma, and you can suddenly see Downworlders like werewolves, vampires, and faeries? If Clary left the world of the Shadowhunters behind, it would mean more time with her best friend, Simon, who's becoming more than a friend. But the Shadowhunting world isn't ready to let her go — especially her handsome, infuriating, newfound brother, Jace. And Clary's only chance to help her mother is to track down rogue Shadowhunter Valentine, who is probably insane, certainly evil — and also her father.To complicate matters, someone in New York City is murdering Downworlder children. Is Valentine behind the killings — and if he is, what is he trying to do? When the second of the Mortal Instruments, the Soul-Sword, is stolen, the terrifying Inquisitor arrives to investigate and zooms right in on Jace. How can Clary stop Valentine if Jace is willing to betray everything he believes in to help their father?In this breathtaking sequel to City of Bones, Cassandra Clare lures her readers back into the dark grip of New York City's Downworld, where love is never safe and power becomes the deadliest temptation.","['Fantasy', 'Young Adult', 'Romance', 'Paranormal', 'Urban Fantasy', 'Fiction', 'Vampires']"
41,Harry Potter and the Deathly Hallows,J.K. Rowling,"Harry has been burdened with a dark, dangerous and seemingly impossible task: that of locating and destroying Voldemort's remaining Horcruxes. Never has Harry felt so alone, or faced a future so full of shadows. But Harry must somehow find within himself the strength to complete the task he has been given. He must leave the warmth, safety and companionship of The Burrow and follow without fear or hesitation the inexorable path laid out for him...In this final, seventh installment of the Harry Potter series, J.K. Rowling unveils in spectacular fashion the answers to the many questions that have been so eagerly awaited.","['Fantasy', 'Young Adult', 'Fiction', 'Magic', 'Childrens', 'Adventure', 'Audiobook']"
42,Poison Study,Maria V. Snyder,"Choose: A quick death… or slow poison...About to be executed for murder, Yelena is offered an extraordinary reprieve. She'll eat the best meals, have rooms in the palace—and risk assassination by anyone trying to kill the Commander of Ixia.And so Yelena chooses to become a food taster. But the chief of security, leaving nothing to chance, deliberately feeds her Butterfly's Dust—and only by appearing for her daily antidote will she delay an agonizing death from the poison.As Yelena tries to escape her new dilemma, disasters keep mounting. Rebels plot to seize Ixia and Yelena develops magical powers she can't control. Her life is threatened again and choices must be made. But this time the outcomes aren't so clear...","['Fantasy', 'Young Adult', 'Romance', 'Magic', 'Fiction', 'Young Adult Fantasy', 'High Fantasy']"
43,Catching Fire,Suzanne Collins,"Sparks are igniting.Flames are spreading.And the Capitol wants revenge. Against all odds, Katniss Everdeen has won the Hunger Games. She and fellow District 12 tribute Peeta Mellark are miraculously still alive. Katniss should be relieved, happy even. After all, she has returned to her family and her longtime friend, Gale. Yet nothing is the way Katniss wishes it to be. Gale holds her at an icy distance. Peeta has turned his back on her completely. And there are whispers of a rebellion against the Capitol—a rebellion that Katniss and Peeta may have helped create. Much to her shock, Katniss has fueled an unrest that she's afraid she cannot stop. And what scares her even more is that she's not entirely convinced she should try. As time draws near for Katniss and Peeta to visit the districts on the Capitol's cruel Victory Tour, the stakes are higher than ever. If they can't prove, without a shadow of a doubt, that they are lost in their love for each other, the consequences will be horrifying.In Catching Fire, the second novel of the Hunger Games trilogy, Suzanne Collins continues the story of Katniss Everdeen, testing her more than ever before . . . and surprising readers at every turn.","['Young Adult', 'Fiction', 'Fantasy', 'Science Fiction', 'Romance', 'Audiobook', 'Teen']"
44,Midnight in the Garden of Good and Evil,John Berendt,"Shots rang out in Savannah's grandest mansion in the misty, early morning hours of May 2, 1981. Was it murder or self-defense? For nearly a decade, the shooting and its aftermath reverberated throughout this city of moss-hung oaks and shaded squares. John Berendt's narrative reads like a thoroughly engrossing novel, and yet it is a work of nonfiction. Berendt interweaves a first-person account of life in this isolated remnant of the Old South with the unpredictable twists and turns of a landmark murder case.The story is peopled by a gallery of remarkable characters: the well-bred society ladies of the Married Woman's Card Club; the turbulent young redneck gigolo; the hapless recluse who owns a bottle of poison so powerful it could kill every man, woman, and child in Savannah; the aging and profane Southern belle who is the ""soul of pampered self-absorption""; the uproarious black drag queen; the acerbic and arrogant antiques dealer; the sweet-talking, piano-playing con artist; young blacks dancing the minuet at the black debutante ball; and Minerva, the voodoo priestess who works her magic in the graveyard at midnight. These and other Savannahians act as a Greek chorus, with Berendt revealing the alliances, hostilities, and intrigues that thrive in a town where everyone knows everyone else.","['Nonfiction', 'True Crime', 'Mystery', 'Crime', 'History', 'Classics', 'Audiobook']"
45,Fragile Eternity,Melissa Marr,"Seth never expected he would want to settle down with anyone - but that was before Aislinn. She is everything he'd ever dreamed of, and he wants to be with her forever. Forever takes on new meaning, though, when your girlfriend is an immortal faery queen.Aislinn never expected to rule the very creatures who'd always terrified her - but that was before Keenan. He stole her mortality to make her a monarch, and now she faces challenges and enticements beyond any she'd ever imagined.In Melissa Marr's third mesmerizing tale of Faerie, Seth and Aislinn struggle to stay true to themselves and each other in a milieu of shadowy rules and shifting allegiances, where old friends become new enemies and one wrong move could plunge the Earth into chaos.","['Fantasy', 'Young Adult', 'Paranormal', 'Romance', 'Urban Fantasy', 'Fairies', 'Fae']"
46,The Graveyard Book,"Neil Gaiman, Dave McKean (Illustrator)","Nobody Owens, known to his friends as Bod, is a perfectly normal boy. Well, he would be perfectly normal if he didn't live in a graveyard, being raised and educated by ghosts, with a solitary guardian who belongs to neither the world of the living nor the world of the dead.There are dangers and adventures for Bod in the graveyard: the strange and terrible menace of the Sleer; a gravestone entrance to a desert that leads to the city of ghouls; friendship with a witch, and so much more.But it is in the land of the living that real danger lurks, for it is there that the man Jack lives and he has already killed Bod's family.A deliciously dark masterwork by bestselling author Neil Gaiman, with illustrations by award-winning Dave McKean.","['Fantasy', 'Young Adult', 'Fiction', 'Horror', 'Middle Grade', 'Paranormal', 'Childrens']"
47,Eyes Like Stars,Lisa Mantchev,"
All her world's a stage.
Bertie Shakespeare Smith is not an actress, yet she lives in a theater.She's not an orphan, but she has no parents.She knows every part, but she has no lines of her own.That is, until now. Enter Stage Right  NATE. Dashing pirate. Will do anything to protect Bertie.  COBWEB, MOTH, MUSTARDSEED, and PEASEBLOSSOM. Four tiny and incredibly annoying fairies. BERTIE'S sidekicks.  ARIEL. Seductive air spirit and Bertie's weakness. The symbol of impending doom. BERTIE. Our heroine.  Welcome to the Théâtre Illuminata, where the actors of every play ever written can be found behind the curtain. They were born to play their parts, and are bound to the Théâtre by The Book, an ancient and magical tome of scripts. Bertie is not one of them, but they are her family, and she is about to lose them all and the only home she has ever known. Lisa Mantchev has written a debut novel that is dramatic, romantic, and witty, with an irresistible and irreverent cast of characters who are sure to enchant the audience.  Open Curtain","['Fantasy', 'Young Adult', 'Romance', 'Fiction', 'Magic', 'Fairies', 'Young Adult Fantasy']"
48,The Last Olympian,Rick Riordan,"All year the half-bloods have been preparing for battle against the Titans, knowing the odds of victory are grim. Kronos's army is stronger than ever, and with every god and half-blood he recruits, the evil Titan's power only grows.While the Olympians struggle to contain the rampaging monster Typhon, Kronos begins his advance on New York City, where Mount Olympus stands virtually unguarded. Now it's up to Percy Jackson and an army of young demigods to stop the Lord of Time. In this momentous final book in the New York Times best-selling series, the long-awaited prophecy surrounding Percy's sixteenth birthday unfolds. And as the battle for Western civilization rages on the streets of Manhattan, Percy faces a terrifying suspicion that he may be fighting against his own fate.","['Fantasy', 'Young Adult', 'Mythology', 'Fiction', 'Middle Grade', 'Adventure', 'Greek Mythology']"
